Name,Type,Units,FullDescription,Description
ZWARN,int64,,Redshift warning bitmask from Redrock,Redshift warning bitmask from Redrock
ZWARN_MTL,int64,,The ZWARN from the zmtl file (contains extra bits),ZWARN from the zmtl file (contains extra bits)
Z_CIII,float64,,Redshift estimated by QuasarNET with CIII line,Redshift estimated by QuasarNET with CIII line
Z_CIV,float64,,Redshift estimated by QuasarNET with CIV line,Redshift estimated by QuasarNET with CIV line
Z_Halpha,float64,,Redshift estimated by QuasarNET with Halpha line,Redshift estimated by QuasarNET w\ Halpha line
Z_Hbeta,float64,,Redshift estimated by QuasarNET with Hbeta line,Redshift estimated by QuasarNET w\ Hbeta line
Z_HP,float64,,Redshift from Healpix coadd,Redshift from Healpix coadd
Z_LYA,float64,,Redshift estimated by QuasarNET with LyA line,Redshift estimated by QuasarNET with LyA line
Z_MgII,float64,,Redshift estimated by QuasarNET with MgII line,Redshift estimated by QuasarNET with MgII line
Z_QN,float64,,Redshift measured by QuasarNET using line with highest confidence,Redshift by QuasarNET; highest confidence line
Z_QN_CONF,float64,,Redshift confidence from QuasarNET,Redshift confidence from QuasarNET
Z_RR,float64,,Redshift collected from redrock file,Redshift collected from redrock file